Question Type,Reference,Question,Answer
INT,11:38,In dens and caves of what?,The earth
INT,11:38,What in deserts and mountains?,Wandering about
INT,11:40,Who had provided something better for us?,God
INT,11:40,That apart from us they what?,Should not be made perfect
QT,12:1,Quote Hebrews 12:1,"Therefore, since we are surrounded by so great a cloud of witnesses, let us also lay aside every weight, and sin which clings so closely, and let us run with endurance the race that is set before us,"
QT,12:2,Quote Hebrews 12:2,"looking to Jesus, the founder and perfecter of our faith, who for the joy that was set before him endured the cross, despising the  shame, and is seated at the right hand of the throne of God."
FTV,12:1,"Therefore, since we are surrounded ","by so great a cloud of witnesses, let us also lay aside every weight, and sin which clings so closely, and let us run with endurance the race that is set before us,"
FTV,12:2,"looking to Jesus, the founder ","and perfecter of our faith, who for the joy that was set before him endured the cross, despising the shame, and is seated at the right hand of the throne of God."
INT,12:1,"Therefore, since we are surrounded by what?",So great a cloud of witnesses
INT,12:1,So great a cloud of what?,Witnesses
MA,12:1,Let us also lay aside what?,Every weight and sin which clings so closely
INT,12:1,"What, which clings so closely?",Sin
INT,12:1,What every weight and sin which clings so closely?,Let us lay aside
INT,12:1,Let us run how?,With endurance
INT,12:1,Let us run with endurance what?,The race that is set before us
INT,12:1,The race that is what?,Set before us
INT,12:1,What clings so closely?,Sin
INT,12:2,"Who, the founder and perfecter of our faith?",Jesus
INT,12:2,What and perfecter of our faith?,The founder
INT,12:2,"Jesus, the founder and perfecter of our faith, who for the joy that was set before him what?",Endured the cross
INT,12:2,"Endured the cross, despising what?",The shame
INT,12:2,What the shame?,Despising
INT,12:2,"Endured the cross, despising the shame, and is what?",Seated at the right hand of the throne of God
INT,12:3,Endured from sinners such hostility against whom?,Himself
INT,12:3,"Endured from sinners such hostility against himself, why?",So that you may not grow weary or fainthearted
INT,12:3,You may not grow weary or what?,Fainthearted
INT,12:3,What or fainthearted?,Weary
INT,12:4,You have not yet resisted how?,To the point of shedding your blood
INT,12:4,You have not yet resisted to the point of shedding your blood where?,In you struggle against sin
INT,12:5,And have you forgotten what?,The exhoration that addresses you as sons
INT,12:5,Have you forgotten the exhortation that what?,Addresses you as sons
INT,12:5,The exhortation that addresses you as what?,Sons
INT,12:5,"My son, do not regard lightly what?",The discipline of the Lord
INT,12:5,Nor be weary when reproved by whom?,The Lord
INT,12:6,He loves and chastises whom?,Every son whom he receives
INT,12:6,And chastises every son whom he what?,Receives
INT,12:7,God is treating you how?,As sons
INT,12:8,Then you are illegitimate what?,Children
INT,12:8,Then you are illegitimate children and not what?,Sons
INT,12:9,"Besides this, we have had what?",Earthly fathers who disciplined us
INT,12:10,What for a short time as it seemed best to them?,They disciplined us
INT,12:10,They disciplined us for a short time how?,As it seemed best to them
INT,12:11,For the moment all discipline seems what?,Painful
INT,12:11,All discipline seems painful rather than what?,Pleasant
INT,12:11,What rather than pleasant?,Painful
INT,12:11,"For the moment all discipline seems painful rather than pleasant, but later it what?",Yields the peaceful fruit of righteousness to those who have been trained by it
INT,12:11,It yields the peaceful fruit of what?,Righteousness
INT,12:11,What yields the peaceful fruit of righteousness?,All discipline
INT,12:12,Therefore lift your what?,Drooping hands
INT,12:12,Lift your drooping hands and strengthen what?,Your weak knees
INT,12:12,Strengthen your weak what?,Knees
INT,12:13,Make straight paths for what?,Your feet
INT,12:13,"Make straight paths for your feet, why?",So that what is lame may not be put out of joint but rather be healed
INT,12:13,That what is lame may not be what?,Put out of joint
INT,12:13,What is lame may not be put out of joint but rather what?,Be healed
INT,12:15,That no one fails to obtain what?,The grace of God
MA,12:15,That no root of bitterness what?,Springs up and causes trouble
INT,12:15,Springs up and causes what?,Trouble
INT,12:16,Sexually immoral or unholy like whom?,Esau
INT,12:16,"Unholy like Esau, who what?",Sold his birthright for a single meal
INT,12:16,Sold his birthright for what?,A single meal
INT,12:16,Who sold his birthright for a single meal?,Esau
INT,12:17,"He was rejected, when?","Afterward, when he desired to inherit the blessing"
INT,12:17,He found no chance to what?,Repent
INT,12:17,"He found no chance to repent, though he what?",Sought it with tears
INT,12:17,Though he sought it how?,With tears
MA,12:18,A blazing fire and darkness and what?,Gloom and a tempest
INT,12:19,And the sound of a what?,Trumpet
INT,12:19,What made the hearers beg that no further messages be spoken to them?,A voice whose words
INT,12:19,No further messages be what?,Spoken to them
INT,12:20,They could not endure what?,The order that was given
INT,12:20,If even a beast what?,Touches the mountain
INT,12:20,"If even a beast touches the mountain, what?",It shall be stoned
INT,12:21,"So terrifying was the sight that Moses said, what?",I tremble with fear
INT,12:21,"Moses said, ""I tremble"" how?",With fear
INT,12:22,Which Mount?,Zion
INT,12:22,"What, the heavenly Jerusalem?",The city of the living God
INT,12:22,What in festal gathering?,Innumerable angels
INT,12:23,And to the assembly of whom?,The firstborn who are enrolled in heaven
INT,12:23,The assembly of the firstborn who are enrolled where?,In heaven
INT,12:25,That you do not refuse who?,Him who is speaking
INT,12:25,Do not refuse him who is what?,Speaking
INT,12:25,Much less will we escape if we what?,Reject him who warns from heaven
INT,12:25,If we reject him who warns from where?,Heaven
INT,12:26,His voice shook what?,The earth
MA,12:26,Once more I will shake what?,Not only the earth but also the heavens
INT,12:27,"This phrase, ""Yet once more,"" indicates what?",The removal of things that are shaken
INT,12:27,Indicates the removal of what?,Things that are shaken
INT,12:27,"This phrase, ""Yet once more,"" indicates the removal of things that are shaken, why?",In order that the things that cannot be shaken may remain
INT,12:28,Therefore let us be grateful for what?,Receiving a kingdom that cannot be shaken
INT,12:28,"What, with reverence and awe?",Let us offer to God acceptable worship
INT,12:29,Who is a consuming fire?,Our God
QT,13:20,Quote Hebrews 13:20,"Now may the God of peace who brought again from the dead our Lord Jesus, the great shepherd of the sheep, by the blood of the eternal covenant,"
QT,13:21,Quote Hebrews 13:21,"equip you with everything good that you may do his will, working in us that which is pleasing in his sight, through Jesus Christ, to whom be glory forever and ever. Amen."
FTV,13:20,Now may the God of ,"peace who brought again from the dead our Lord Jesus, the great shepherd of the sheep, by the blood of the eternal covenant,"
FTV,13:21,equip you with everything good ,"that you may do his will, working in us that which is pleasing in his sight, through Jesus Christ, to whom be glory forever and ever. Amen."
INT,13:1,Let brotherly love what?,Continue
INT,13:2,Show hospitality to whom?,Strangers
INT,13:2,For thereby some have entertained whom?,Angels
INT,13:2,Thereby some have entertained angels how?,Unawares
INT,13:4,What be held in honor among all?,Marriage
INT,13:4,Let the marriage bed be what?,Undefiled
INT,13:4,"Let the marriage bed be undefiled, why?",For God will judge the sexually immoral and adulterous
INT,13:5,Keep your life freer from what?,Love of money
INT,13:5,And be content with what?,What you have
INT,13:5,"Be content with what you have, why?","For he has said, ""I will never leave you nor forsake you."""
MA,13:6,"So we can confidently say, what?","""The Lord is my helper; I will not fear; what can man do to me?"""
INT,13:6,The Lord is my helper; I will not what?,Fear
INT,13:7,Consider the outcome of what?,Their way of life
INT,13:7,Imitate what?,Their faith
INT,13:8,Who is the same yesterday and today and forever?,Jesus Christ
MA,13:8,The same yesterday and when?,Today and forever
MA,13:9,Which teachings?,Diverse and strange
INT,13:9,Led away by diverse and strange what?,Teachings
INT,13:9,"What to be strengthened by grace, not by foods?",The heart
INT,13:9,The heart to be strengthened by what?,Grace
INT,13:9,"Not by foods, which have not what?",Benefited those devoted to them
INT,13:9,Have not benefited those devoted to what?,Foods
INT,13:11,The bodies of those animals whose blood is what?,Brought into the holy places by the high priest
INT,13:11,The bodies of those animals whose blood is brought into the holy places by the high priest as a sacrifice for sin are burned where?,Outside the camp
INT,13:12,Also suffered outside the gate why?,In order to sanctify the people through his own blood
INT,13:14,For here we have no what?,City
INT,13:14,"For here we have no lasting city, but we what?",Seek the city that is to come
INT,13:15,The fruit of lips that acknowledge what?,His name
INT,13:15,What of lips that acknowledge his name?,The fruit
INT,13:17,Submit to whom?,Your leaders
INT,13:17,"Submit to them, why?",For they are keeping watch over your souls
INT,13:17,"They are keeping watch over your souls, as whom?",Those who will have to give an account
INT,13:18,Desiring to act how?,Honorably
INT,13:18,Desiring to act honorably how?,In all things
INT,13:19,I urge you how?,The more earnestly
INT,13:19,I urge you the more earnestly to do this why?,In order that I may be restored to you the sooner
INT,13:19,I may be restored to you when?,The sooner
INT,13:20,The great shepherd of what?,The sheep
INT,13:20-21,Equip you with everything good how?,By the blood of the eternal covenant
INT,13:20,"The great shepherd of the sheep, by the blood of what?",The eternal covenant
INT,13:21,Equip you with everything what?,Good
INT,13:21,Equip you with everything good why?,That you may do his will
INT,13:21,Working in us what?,That which is pleasing in his sight
INT,13:21,"Working in us that which is pleasing in his sight, through whom?",Jesus Christ
MA,13:21,"Working in us that which is pleasing in his sight, through Jesus Christ, to whom be glory when?",Forever and ever
INT,13:22,"I appeal to you brothers, what?",Bear with my word of exhortation
INT,13:22,"I appeal to you brothers, bear with my word of exhortation, for I have written to you how?",Briefly
INT,13:23,Our brother Timothy has been what?,Released
INT,13:23,Who has been released?,Our brother Timothy
INT,13:23,What if he comes soon?,I shall see you
MA,13:24,Greet whom?,All your leaders and all the saints
INT,13:24,Those who come from Italy what?,Send you greetings
INT,13:24,Who send you greetings?,Those who come from Italy
INT,13:24-25,Those who come from Italy send you greetings. Grace be with whom?,All of you