Question Type,Reference,Question,Answer
INT,7:13,Has ever served where?,At the altar
INT,7:14,In connection with that tribe Moses said what?,Nothing about priests
INT,7:15,This becomes even more what?,Evident
INT,7:15,Another priest arises how?,In the likeness of Melchizedek
INT,7:15,Another priest arises in the likeness of who?,Melchizedek
INT,7:16,Which basis?,A legal requirement
INT,7:16,Which requirement?,A legal
INT,7:16,Not on the basis of a legal requirement concerning what?,Bodily descent
INT,7:16,An indestructible what?,Life
INT,7:17,"For it is witnessed of him, what?","You are a priest forever, after the order of Melchizedek"
INT,7:18,What and uselessness?,Weakness
INT,7:19,What is intrroduced?,A better hope
INT,7:19,"A better hope is introduced, through which we what?",Draw near to God
INT,7:21,What his mind?,Change
INT,7:21,"Will not change his mind, you are what?",A priest forever
INT,7:22,This makes Jesus the guarantor of what?,A better covenant
INT,7:23,What were many in number?,The former priests
INT,7:23,Many in number why?,Because they were prevented by death from continuing in office
INT,7:23,Prevented by death from what?,Continuing in office
INT,7:24,But he holds his priesthood how?,Permanently
INT,7:24,"He holds his priesthood permanently, why?",Because he continues forever
INT,7:25,Save to the uttermost who?,Those who draw near to God through him
INT,7:25,To make intercession for who?,Those who draw near to God through him
INT,7:26,"Holy, innocent, unstained, separated from sinners and what?",Exalted above the heavens
INT,7:26,Exalted where?,Above the heavens
INT,7:26,Separated from who?,Sinners
INT,7:26,"Who, holy, innnocent, unstained, separated from sinners and exalted above the heaves?",Such a high priest
QT,8:1,Quote Hebrews 8:1,"Now the point in what we are saying is this: we have such a high priest, one who is seated at the right hand of the throne of the Majesty in heaven, "
QT,8:2,Quote Hebrews 8:2,"a minister in the holy places, in the true tent that the Lord set up, not man."
FTV,8:1,"Now the point in what Majesty in heaven, ","we are saying is this: we have such a high priest, one who is seated at the right hand of the throne of the"
FTV,8:2,a minister in the holy ,"places, in the true tent that the Lord set up, not man."
MA,8:2,A minister where?,"In the holy places, in the true tent that the Lord set up"
INT,8:2,A minister in the holy what?,Places
INT,8:5,They serve a copy and shadow of what?,The heavenly things
INT,8:5,They serve a copy and what?,Shadow
INT,8:5,Who was about to erect the tent?,Moses
INT,8:5,Moses was about to erect what?,The tent
INT,8:5,He was instructed by who?,God
INT,8:5,"He was instructed by God, saying what?",See that you make everything according to the pattern that was shown you on the mountain
INT,8:5,The pattern that was shown you where?,On the mountain
INT,8:5,Which pattern?,The pattern that was shown you on the mountain
INT,8:6,Christ has obtained a ministry that is what?,As much more excellent than the old as the covenant he mediates is better
INT,8:6,The covenant he mediates is what?,Better
INT,8:6,"The covenant he mediates is better, why?",Since it is enacted on better promises
INT,8:6,It is enacted on what?,Better promises
INT,8:6,What is enacted on better promises?,The covenant he mediates
INT,8:7,What had been faultless?,That first covenant
INT,8:7,No occasion to what?,Look for a second
INT,8:7,What to look for a second?,No occasion
INT,8:7,No occasion to look for what?,A second
INT,8:8,For he finds what?,Fault with them
INT,8:8,Who finds fault with them?,The Lord
INT,8:9,Bring them out of the land of Egypt how?,By the hand
INT,8:9,By the hand to bring them where?,Out of the land of Egypt
INT,8:9,And so I showed what?,No concern for them
INT,8:9,"I showed no concern for them, declares who?",The Lord
INT,8:11,From the least of them to what?,The greatest
INT,8:11,What to the greatest?,The least of them
INT,8:12,What toward their iniquities?,I will be merciful
INT,8:12,"Merciful toward their iniquities, and I will what?",Remember their sins no more
INT,8:13,And what is becoming obsolete and what?,Growing old
INT,8:13,Becoming obsolete and growing old is what?,Ready to vanish away
INT,8:13,Ready to what?,Vanish away
INT,8:13,What to vanish away?,Ready
INT,8:13,What and growing old?,Obsolete
QT,9:27,Quote Hebrews 9:27,"And just as it is appointed for man to die once, and after that comes judgment,"
QT,9:28,Quote Hebrews 9:28,"so Christ, having been offered once to bear the sins of many, will appear a second time, not to deal with sin but to save those who are eagerly waiting for him."
FTV,9:27,And just as it is,"appointed for man to die once, and after that comes judgment,"
FTV,9:28,"so Christ, having been offered ","once to bear the sins of many, will appear a second time, not to deal with sin but to save those who are eagerly waiting for him."
MA,9:2,The lampstand and what?,The table and the bread of the presence
INT,9:2,The bread of the what?,Presence
INT,9:2,The table and the what?,Bread of the presence
INT,9:2,In which were the lampstand and the table and the bread of the presence. It is called what?,The Holy Place
INT,9:4,The golden altar of incense and what?,The ark of the covenant
INT,9:4,What with gold?,Covered on all sides
INT,9:4,Ark of the covenant covered how?,On all sides with gold
INT,9:4,Ark of the covenant covered on all sides with what?,Gold
MA,9:4,A golden urn holding the manna and what?,"Aaron's staff that budded, and the tablets of the covenant"
INT,9:4,The tablets of what?,The covenant
INT,9:4,What budded?,Aaron's staff
INT,9:4,Which urn?,A golden
INT,9:5,Above it were the cherubim of what?,Glory
INT,9:5,The cherubim of glory overshadowing what?,The mercy seat
INT,9:5,Overshadowing what?,The mercy seat
INT,9:5,Which seat?,The mercy seat
INT,9:6,These preparations having been what?,Thus made
INT,9:6,The priests go regularly where?,Into the first section
INT,9:6,"The priests go regularly into the first section, performing what?",Their ritual duties
INT,9:6,Performing their ritual what?,Duties
INT,9:6,Which duties?,Their ritual
INT,9:7,The high priest goes where?,Into the second
INT,9:7,"The high priest goes, and he but when?",Once a year
MA,9:7,"Not without taking blood, which he offers for what?",Himself and for the unintentional sins of the people
INT,9:7,The unintentional sins of whom?,The people
INT,9:7,The unintentional what?,Sins of the people
INT,9:7,"Blood, which he offers for himself and for what?",The unintentional sins of the people
INT,9:8,What is still standing?,The first section
INT,9:8-9,Is still standing (which is symbolic for) what?,The present age
INT,9:9,"According to this arrangement, what?",Gifts and sacrifices are offered that cannot perfect the conscience of the worshiper
INT,9:9,What of the worshiper?,The conscience
INT,9:10,Only with food and drink and what?,Various washings
INT,9:10,"What, imposed until the time of reformation?",Regulations for the body
INT,9:10,What of reformation?,The time
INT,9:11,What not of this creation?,The greater and more perfect tent
INT,9:12,Securing an eternal redemption how?,By means of his own blood
INT,9:12,Thus securing what?,An eternal redemption
INT,9:12,Which redemption?,An eternal
INT,9:13,What and the sprinkling of defiled persons with the ashes of a heifer?,The blood of goats and bulls
INT,9:13,The sprinkling of defiled what?,Persons
INT,9:13,The sprinkling of defiled persons how?,With the ashes of a heifer
INT,9:13,With the ashes of what?,A heifer
INT,9:14,Offered himself without blemish to God how?,Through the eternal Spirit
INT,9:14,Offered himself without blemish to who?,God
INT,9:14,Purify our what?,Conscience
INT,9:14,Purify our conscience from what?,Dead works
INT,9:14,Purify our conscience from dead works why?,To serve the living God
INT,9:15,Since a death has occured that what?,Redeems them from the transgressions committed under the first covenant
INT,9:15,Since a death has occured that redeems them from what?,The transgressions committed under the first covenant
INT,9:15,The transgressions committed where?,Under the first covenant
INT,9:16,"Where a will is involved, the death of the one who made it must be what?",Established
INT,9:16,What must be established?,The death of the one who made it
INT,9:17,A will takes effect when?,Only at death
INT,9:17,"A will takes effect only at death, why?",Since is is not in force as long as the one who made it is alive.
INT,9:17,What is inot in force?,A will
INT,9:17,Who is alive?,The one who made it
INT,9:18,What was inaugurated without blood?,Not even the first covenant
INT,9:19,With water and scarlet wool and what?,Hyssop
INT,9:19,Scarlet what?,Wool
INT,9:19,Which wool?,Scarlet
MA,9:19,What and hyssop?,Water and scarlet wool
MA,9:19,Sprinkled both the book itself and all the people how?,With water and scarlet wool and hyssop
INT,9:19,Sprinkled both the book itself and what?,All the people
INT,9:19,Sprinkled both the book itself and all the people when?,When every commandment of the law had been declared by Moses to all the people
INT,9:20,What that God commanded for you?,This is the blood of the covenant
INT,9:21,All the vessels used how?,In worship
INT,9:22,"Indeed, under the law almost everything is what?",Purified with blood
INT,9:22,"Under the law almost everything is purified with blood, and what?",Without the shedding of blood there is no forgiveness of sins
INT,9:23,What purified with these rites?,Copies of the heavenly things
INT,9:23,"Purified with these rites, but the heavenly things themselves with what?",Better sacrifices than these
INT,9:26,Would have had to suffer how?,Repeatedly
INT,9:26,Would have had to suffer repeatedly since when?,The foundation of the world
INT,9:26,The end of the ages to put awat sin how?,By the sacrifice of himself
INT,9:27,What for man to die once?,It is appointed
INT,9:27,"Appointed for man to die once, and after that comes what?",Judgment
INT,9:28,Those who are eagerly waiting for who?,Christ
INT,9:28,What those who are eagerly waiting for him?,To save
QT,10:12,Quote Hebrews 10:12,"But when Christ had offered for all time a single sacrifice for sins, he sat down at the right hand of God,"
QT,10:13,Quote Hebrews 10:13,waiting from that time until his enemies should be made a footstool for his feet.
QT,10:14,Quote Hebrews 10:14,For by a single offering he has perfected for all time those who are being sanctified.
FTV,10:12,But when Christ had offered ,"for all time a single sacrifice for sins, he sat down at the right hand of God,"
FTV,10:13,waiting from that time until,his enemies should be made a footstool for his feet.
FTV,10:14,For by a single offering,he has perfected for all time those who are being sanctified.
INT,10:1,Things to come instead of what?,The true form of these realities
INT,10:1,The true form of what?,These realities
INT,10:1,What of these realities?,The true form
INT,10:1,What things to come instead of the true form of these realities?,A shadow of the good
INT,10:1,"Instead of the true form of these realities, it can never what?",Make perfect those who draw near
INT,10:2,"Otherwise, would they not have what??",Ceased to be offered
INT,10:2,Ceased to be what?,Offered
INT,10:2,Ceased to be offered why?,Since the worshipers would no longer have any consciousness of sins
INT,10:2,"Who, having once been cleansed?",The worshipers
INT,10:2,"The worshipers, having once been cleansed, would no longer have what?",Any consciousness of sins
INT,10:3,There is a reminder of sins every year how?,In these sacrifices
INT,10:7,In the scroll of what?,The book
INT,10:7,What of the book?,The scroll
INT,10:9,"Then he added, what?","Behold, I have come to do your will."
INT,10:14,He has perfected for all time those who are being sanctified how?,By a single offering
INT,10:14,He has perfected for what?,All time
INT,10:14,He has perfected for all time who?,Those who are being sanctified
INT,10:17,"Then he adds, what?",I will remember their sins and their lawless deeds no more
MA,10:17,"Then he adds, I will remember what?",Their sins and their lawless deeds
INT,10:17,Which deeds?,Their lawless
INT,10:17,Their lawless what?,Deeds
INT,10:17,What and their lawless deeds no more?,I will remember their sins
INT,10:22,What sprinkled clean from an evil conscience?,Our hearts
INT,10:22,Hearts sprinkled clean from an evil conscience and what?,Our bodies washed with pure water
INT,10:22,Our bodies washed how?,With pure water
INT,10:22,Pure what?,Water
INT,10:22,What with pure water?,Washed
INT,10:23,What without wavering?,Hold fast to the confession of our hope
INT,10:23,"Without wavering, why?",For he who promised is faithful
INT,10:23,"Without wavering, for he who promised is what?",Faithful
MA,10:24,How to stir up one another to what?,Love and good works
INT,10:25,Not neglecting to what?,Meet together
INT,10:25,Meet how?,Together
INT,10:25,What together?,Meet
INT,10:25,"Not neglecting to meet together, as is the habit of some, but what?",Encouraging one another
INT,10:25,Encouraging one another how?,All the more as you see the Day drawing near
INT,10:25,The Day drawing what?,Near
INT,10:26,If we go on sinning how?,Deliberately
INT,10:26,If we go on sinning deliberately when?,After receiving the knowledge of the truth
INT,10:26,After receiving the knowledge of what?,The truth
INT,10:27,But a fearful expectation of what?,Judgement
INT,10:27,A fury of what?,Fire
INT,10:27,A fury of fire that will what?,Consume the adversaries
INT,10:27,What that will consume the adversaries?,A fury of fire
INT,10:27,A fury of fire that will consume who?,The adversaries
INT,10:28,Anyone who has what?,Set aside the law of Moses
INT,10:28,Anyone who has set aside the law of Moses what?,Dies without mercy
INT,10:28,Who dies without mercy on the evidence of two or three witnesses?,Anyone who has set aside the law of Moses
INT,10:28,Anyone who has set aside the law of Moses dies how?,Without mercy
INT,10:28,Dies without mercy how?,On the evidence of two or three witnesses
MA,10:28,Dies without mercy on the evidence of whom?,Two or three witnesses
INT,10:29,How much worse what?,Punishment
INT,10:29,Which punishment?,Worse punishment
INT,10:29,"How much worse punishment, do you think, will be deserved by who?",The one who has trampled underfoot the son of God
INT,10:29,The one who has trampled how?,Underfoot
INT,10:29,The one who has trampled underfoot who?,The Son of God
MA,10:29,"The one who has trampled underfoot the Son of God, and has what?","Profaned the blood of the covenant by which he was sanctified, and has outraged the Spirit of grace"
INT,10:29,And has profaned what?,The blood of the covenant
INT,10:29,And has profaned the blood of the covenant by what?,Which he was sanctified
INT,10:29,And has outraged whom?,The Spirit of grace
INT,10:30,What is mine?,Vengance
INT,10:30,Vengance is mine; what?,I will repay
INT,10:30,"What, I will repay?",Vengance is mine
INT,10:30,"""Vengance is mine; I will repay."" And again, what?","""The Lord will judge his people."""
INT,10:31,It is a fearful thing to what?,Fall into the hands of the living God
INT,10:31,It is a fearful thing to fall into the hands of whom?,The living God
INT,10:32,But recall what?,The former days
INT,10:32,"What, a hard struggle with sufferings?",You endured
INT,10:32,"What, with sufferings?",A hard struggle
MA,10:33,Sometimes being publicly exposed to what?,Reproach and affliction
INT,10:33,What and affliction?,Reproach
INT,10:33,And sometimes being partners with whom?,Those so treated
INT,10:33,"What, with those so treated?",Being partners
INT,10:34,For you had compassion on those where?,In prison
INT,10:34,You joyfully what?,Accepted the plundering of your property
INT,10:34,You joyfully accepted what?,The plundering of your property
INT,10:34,The plundering of what?,Your property
INT,10:34,"You joyfully accepted the plundering of your property, why?",Since you knew that you yourselves had a better possession and an abiding one
INT,10:34,Since you knew what?,That you yourselves had a better possession
INT,10:34,A better possession and what?,An abiding one
INT,10:35,Therefore do not throw away what?,Your confidence
INT,10:35,"Therefore do not throw away your confidence, which has what?",A great reward
INT,10:36,When you have done what?,The will of God
INT,10:36,"When you have done the will of God, you may what?",Receive what is promised
INT,10:37,Who will not delay?,The coming one
INT,10:38,"If he shrinks back, what?",My soul has no pleasure in him
INT,10:39,Those who shrink back and are what?,Destroyed
INT,10:39,What and are destroyed?,Those who shrink back
INT,10:39,Who preserve their souls?,Those who have faith
INT,10:39,Have faith and preserve what?,Their souls
QT,11:1,Quote Hebrews 11:1,"Now faith is the assurance of things hoped for, the conviction of things not seen."
QT,11:2,Quote Hebrews 11:2,For by it the people of old received their commendation.
QT,11:3,Quote Hebrews 11:3,"By faith we understand that the universe was created by the word of God, so that what is seen was not made out of things that are visible."
FTV,11:1,Now faith is the assurance ,"of things hoped for, the conviction of things not seen."
FTV,11:2,For by it the people,of old received their commendation.
FTV,11:3,By faith we understand that,"the universe was created by the word of God, so that what is seen was not made out of things that are visible."
INT,11:1,"The assurance of things hoped for, what?",The conviction of things not seen
INT,11:1,What of things hoped for?,The assurance
INT,11:1,The conviction of what?,Things not seen
INT,11:2,Who received their commendation?,The people of old
INT,11:2,Received their commendation how?,By it (faith)
INT,11:3,By faith we understand what?,That the universe was created by the word of God
INT,11:3,We understand that the universe was created by the word of God how?,By faith
INT,11:4,"More acceptable sacrifice than Cain, through which he was what?",Commended as righteous
INT,11:4,God commending him how?,By accepting his gifts
INT,11:4,What by accepting his gifts?,God commending him
INT,11:5,By faith Enoch was what?,Taken up so that he should not see death
INT,11:5,Enoch was taken up how?,By faith
INT,11:5,What as having pleased God?,He was commended
INT,11:6,It is impossible to please him how?,Without faith
MA,11:6,"It is impossible to please him, for whoever would draw near to God must what?",Believe that he exists and that he rewards those who seek him
MA,11:6,Must believe that he what?,Exists and that he rewards those who seek him
INT,11:6,He rewards those who what?,Seek him
INT,11:6,He exists and that he what?,Rewards those who seek him
INT,11:7,"By faith Noah, being warned how?",By God
INT,11:7,What as yet unseen?,Events
INT,11:7,Warned by God concerning events as yet what?,Unseen
INT,11:7,Who in reverent fear constructed an ark?,Noah
INT,11:7,Constructed an ark for the saving of his household how?,In reverent fear / In faith
INT,11:7,In reverent fear constructed an ark why?,For the saving of his household
INT,11:7,By this he condemned what?,The world
INT,11:7,By this he condemned the world and became what?,An heir of the righteousness that comes by faith
INT,11:8,By faith Abraham obeyed when?,When he was called to go out to a place that he was to receive as an inheritance.
INT,11:8,Who obeyed when he was called to go out to a place that he was to receive as an inheritance?,Abraham
INT,11:8,No knowing what?,Where he was going
INT,11:8,What where he was going?,Not knowing
MA,11:9,Living in tents with whom?,Isaac and Jacob
INT,11:9,What in tents with Isaac and Jacob?,Living
INT,11:10,For he was looking forward to what?,The city that has foundations
INT,11:10,"The city that has foundations, whose what?",Designer and builder is God
INT,11:10,Whose designer and builder is whom?,God
INT,11:10,"What, whose designer and builder is God?",The city that has foundations
INT,11:10,"Who was looking forward to the city that has foundations, whose designer and builder is God?",Abraham
INT,11:11,By faith Sarah herself what?,Received power to conceive
INT,11:11,Sarah herself received power to conceive how?,By faith
INT,11:11,"Sarah herself received power to conceive, even what?",When she was past the age
INT,11:11,"Even when she was passed the age, why?",Since she considered him faithful who had promised.
INT,11:12,As many as the stars of what?,Heaven
INT,11:12,The innumerable grains of sand where?,By the seashore
INT,11:12,The innumerable what?,Grains of sand by the seashore
INT,11:12,What by the seashore?,The innumerable grains of sand
INT,11:13,Greeted them from where?,Afar
MA,11:13,Having acknowledged that they were what?,Strangers and exiles on the earth
INT,11:13,Exiles on what?,The earth
INT,11:14,They are seeking what?,A homeland
INT,11:15,If they had been thinking of what?,That land from which they had gone out
INT,11:15,They would have had opportunity to what?,Return
INT,11:16,Which country,A better / A heavenly one
INT,11:16,"They desire a better country, that is what?",A heavenly one
INT,11:17,"Abraham, when he was tested, what?",Offered up Issac
INT,11:19,"From which, figuratively speaking, he what?",Did receive him back
INT,11:20,By faith Isaac invoked what?,Future blessings on Jacob and Esau
MA,11:20,By faith Isaac invoked future blessings on whom?,Jacob and Esau
INT,11:20,Which blessings?,Future
INT,11:20,"Isaac invoked future blessings on Jacob and Esau, how?",By faith
INT,11:21,"By faith Jacob, when dying, what?",Blessed each of the sons of Joseph
INT,11:21,Bowing in worship how?,Over the head of his staff
INT,11:21,Bowing in worship over the head of what?,His staff
INT,11:22,Who made mention of the exodus of the Israelites?,Joseph
INT,11:22,The exodus of whom?,The Israelites
INT,11:22,Made mention of the exodus of the Israelites and what?,Gave directions concerning his bones
INT,11:22,What concerning his bones?,Directions
INT,11:23,Hidden for three months by whom?,His parents
INT,11:23,Hidden for three months by his parents why?,Because they saw the child was beautiful
INT,11:23,Who's edict?,The king's
INT,11:23,Not afraid of the king's what?,Edict
INT,11:24,"Moses, when he was grown up, what?",Refused to be called the son of Pharaoh's daughter
INT,11:24,"Moses, when he was grown up, refused to be called the son of Pharaoh's daughter how?",By faith
INT,11:25,Choosing rather to be what?,Mistreated with the people of God
INT,11:25,Choosing rather to be mistreated with the people of God than to what?,Enjoy the fleeting pleasures of sin
INT,11:25,Enjoy the fleeting pleasures of what?,Sin
INT,11:25,Which pleasures of sin?,The fleeting
INT,11:26,Greater wealth than what?,The treasures of Egypt
INT,11:26,What greater wealth than the treasures of Egypt?,The reproach of Christ
INT,11:27,The anger of whom?,The king
INT,11:27,What as seeing him who is invisible?,He endured
INT,11:27,He endured as seeing him who is what?,Invisible
INT,11:28,He kept the Passover how?,By faith
INT,11:28,By faith he kept the Passover and what?,Sprinkled the blood
INT,11:28,"By faith he kept the Passover and sprinkled the blood, why?",So that the Destroyer of the firstborn might not touch them
INT,11:28,The Destroyer of what?,The firstborn
INT,11:28,Who might not touch them?,The Destroyer of the firstborn
INT,11:29,Who crossed the Red Sea as on dry land?,The people
INT,11:29,The people crossed the Red Sea as on dry land how?,By faith
INT,11:29,Which Sea?,The Red
INT,11:29,Crossed the Red Sea as on what?,Dry land
INT,11:29,"But the Egyptians, when they attempted to what?",Do the same
INT,11:29,"But the Egyptians, when they attempted to do the same, were what?",Drowned
INT,11:29,Who were drowned?,The Egyptians
INT,11:30,By faith the walls of Jericho what?,Fell down
INT,11:30,The walls of Jericho fell down when?,After they had been encircled for seven days
INT,11:30,The walls of Jericho fell down how?,By faith
INT,11:30,They had been encircled how?,For seven days
INT,11:30,Encircled for seven what?,Days
INT,11:31,By faith Rahab who?,The prostitute
INT,11:31,By faith Rahab the prostitute did not what?,Perish with those who were disobedient
INT,11:31,Rahab the prostitute did not perish how?,By faith
INT,11:31,She had given a friendly welcome to whom?,The spies
INT,11:31,Which welcome to the spies?,A friendly
INT,11:31,Who had given a friendly welcome to the spies?,Rahab the prostitute
MA,11:32,For time would fail me to tell of whom?,"Gideon, Barak, Samson, Jepthah, of David and Samuel and the prophets"
INT,11:32,Of David and Samuel and whom?,The prophets
INT,11:33,Through faith conquered what?,Kingdoms
INT,11:33,Enforced what?,Justice
INT,11:33,Stopped what?,The mouths of lions
INT,11:33,Stopped the mouths of what?,Lions
INT,11:34,Quenched what?,The power of fire
INT,11:34,Escaped what?,The edge of the sword
INT,11:34,The edge of what?,The sword
INT,11:34,Became mighty where?,In war
INT,11:34,Put foreign armies to what?,Flight
INT,11:34,What to flight?,Foreign armies
INT,11:35,Women received back what?,Their dead
INT,11:35,Women received back their dead how?,By resurrection
INT,11:35,Some were tortured why?,So that they might rise again to a better life
INT,11:35,"Some were tortured, refusing to what?",Accept release
INT,11:35,That they might rise again to what?,A better life
MA,11:36,Others suffered what?,Mocking and flogging
INT,11:36,Others suffered mocking and what?,Flogging
MA,11:36,"Others suffered mocking and flogging, and even what?",Chains and imprisonment
INT,11:36,Even chains and what?,Imprisonment
INT,11:37,"They were sawn in two, they were what?",Killed with the sword
INT,11:37,They were killed how?,With the sword
MA,11:37,They went about in skins of what?,Sheep and goats
INT,11:37,"Destitute, afflicted, what?",Mistreated
MA,11:38,Wandering about where?,"In deserts and mountains, and in dens and caves of the earth"
MA,11:38,"Wandering about in deserts and mountains, and where?",In dens and caves of the earth
